{
  "event_id": "f4e3d2c1-b0a9-4876-b543-210fedcba987",
  "event_name": "qualified_lead_scored",
  "event_time": 1772153800,
  "event_source_url": "https://crm.internal.example.com/scoring/pipeline",
  "action_source": "system_generated",
  "user_data": {
    "em": "4f9b87b7a2cd3e7ef154a1a5cf8a946b5394ef3425f1eb7c569f14d8723c0b56",
    "ph": "96d9632f363564ecd301fab815ccd75d507173d0cb7d11863bc3c60298fb9f1a",
    "client_ip_address": "85.136.120.45",
    "client_user_agent": "Mozilla/5.0 (Macintosh; Intel Mac OS X 10_15_7) AppleWebKit/537.36 (KHTML, like Gecko) Chrome/124.0.0.0 Safari/537.36",
    "external_id": "e3b0c44298fc1c149afbf4c8996fb92427ae41e4649b934ca495991b7852b855"
  },
  "custom_data": {
    "lead_id": "LD-88392",
    "qualification_tier": "SQL",
    "scoring_model_version": "v2.4-xgb-ultra-prime",
    "predicted_conversion_probability": 0.895,
    "currency": "EUR",
    "value": 25000.0,
    "investment_capacity_score": 9.4,
    "intent_velocity_score": 8.8,
    "crm_status": "assigned_to_director"
  }
}
